{
  "schema_version": "document-2.0",
  "receipt_id": "99fbceaa-6108-5e7a-85b0-60d6ca7c11eb",
  "ocr_run_id": "1c4dcea0-7f27-4441-97ac-8914423e3e4d",
  "pages": [
    {
      "page_index": 0,
      "evidence": {
        "schema_version": "1.3",
        "receipt_id": "99fbceaa-6108-5e7a-85b0-60d6ca7c11eb",
        "ocr_run_id": "1c4dcea0-7f27-4441-97ac-8914423e3e4d",
        "engine": {
          "name": "pdfium-text",
          "version": "5.12.1"
        },
        "image": {
          "width_px": 1667,
          "height_px": 1103
        },
        "blocks": [
          {
            "text": "HOA DON / INVOICE",
            "confidence": 1.0,
            "polygon": [
              {
                "x": 0.363129,
                "y": 0.047743
              },
              {
                "x": 0.63726,
                "y": 0.047743
              },
              {
                "x": 0.63726,
                "y": 0.079873
              },
              {
                "x": 0.363129,
                "y": 0.079873
              }
            ],
            "block_id": "p0_b000000",
            "reading_order": 0
          },
          {
            "text": "Cua hang Sao Viet",
            "confidence": 1.0,
            "polygon": [
              {
                "x": 0.060822,
                "y": 0.124401
              },
              {
                "x": 0.213247,
                "y": 0.124401
              },
              {
                "x": 0.213247,
                "y": 0.149198
              },
              {
                "x": 0.060822,
                "y": 0.149198
              }
            ],
            "block_id": "p0_b000001",
            "reading_order": 1
          },
          {
            "text": "Khach hang: Cong ty Demo Ha Noi",
            "confidence": 1.0,
            "polygon": [
              {
                "x": 0.538625,
                "y": 0.127153
              },
              {
                "x": 0.78458,
                "y": 0.127153
              },
              {
                "x": 0.78458,
                "y": 0.148408
              },
              {
                "x": 0.538625,
                "y": 0.148408
              }
            ],
            "block_id": "p0_b000002",
            "reading_order": 2
          },
          {
            "text": "Ma hoa don: HD-0002",
            "confidence": 1.0,
            "polygon": [
              {
                "x": 0.061065,
                "y": 0.168945
              },
              {
                "x": 0.21165,
                "y": 0.168945
              },
              {
                "x": 0.21165,
                "y": 0.185505
              },
              {
                "x": 0.061065,
                "y": 0.185505
              }
            ],
            "block_id": "p0_b000003",
            "reading_order": 3
          },
          {
            "text": "Ngay: 2026-02-02",
            "confidence": 1.0,
            "polygon": [
              {
                "x": 0.06111,
                "y": 0.206752
              },
              {
                "x": 0.18177,
                "y": 0.206752
              },
              {
                "x": 0.18177,
                "y": 0.227803
              },
              {
                "x": 0.06111,
                "y": 0.227803
              }
            ],
            "block_id": "p0_b000004",
            "reading_order": 4
          },
          {
            "text": "Mat hang / Dich vu",
            "confidence": 1.0,
            "polygon": [
              {
                "x": 0.061065,
                "y": 0.440953
              },
              {
                "x": 0.191325,
                "y": 0.440953
              },
              {
                "x": 0.191325,
                "y": 0.462208
              },
              {
                "x": 0.061065,
                "y": 0.462208
              }
            ],
            "block_id": "p0_b000005",
            "reading_order": 5
          },
          {
            "text": "SL",
            "confidence": 1.0,
            "polygon": [
              {
                "x": 0.615956,
                "y": 0.440953
              },
              {
                "x": 0.634121,
                "y": 0.440953
              },
              {
                "x": 0.634121,
                "y": 0.457739
              },
              {
                "x": 0.615956,
                "y": 0.457739
              }
            ],
            "block_id": "p0_b000006",
            "reading_order": 6
          },
          {
            "text": "Don gia",
            "confidence": 1.0,
            "polygon": [
              {
                "x": 0.721083,
                "y": 0.441225
              },
              {
                "x": 0.774423,
                "y": 0.441225
              },
              {
                "x": 0.774423,
                "y": 0.462208
              },
              {
                "x": 0.721083,
                "y": 0.462208
              }
            ],
            "block_id": "p0_b000007",
            "reading_order": 7
          },
          {
            "text": "Thanh tien",
            "confidence": 1.0,
            "polygon": [
              {
                "x": 0.864487,
                "y": 0.441225
              },
              {
                "x": 0.938902,
                "y": 0.441225
              },
              {
                "x": 0.938902,
                "y": 0.457716
              },
              {
                "x": 0.864487,
                "y": 0.457716
              }
            ],
            "block_id": "p0_b000008",
            "reading_order": 8
          },
          {
            "text": "1. So tay",
            "confidence": 1.0,
            "polygon": [
              {
                "x": 0.061284,
                "y": 0.500068
              },
              {
                "x": 0.126495,
                "y": 0.500068
              },
              {
                "x": 0.126495,
                "y": 0.523095
              },
              {
                "x": 0.061284,
                "y": 0.523095
              }
            ],
            "block_id": "p0_b000009",
            "reading_order": 9
          },
          {
            "text": "4",
            "confidence": 1.0,
            "polygon": [
              {
                "x": 0.62079,
                "y": 0.500289
              },
              {
                "x": 0.629143,
                "y": 0.500289
              },
              {
                "x": 0.629143,
                "y": 0.517958
              },
              {
                "x": 0.62079,
                "y": 0.517958
              }
            ],
            "block_id": "p0_b000010",
            "reading_order": 10
          },
          {
            "text": "18.000",
            "confidence": 1.0,
            "polygon": [
              {
                "x": 0.726582,
                "y": 0.500289
              },
              {
                "x": 0.774178,
                "y": 0.500289
              },
              {
                "x": 0.774178,
                "y": 0.518253
              },
              {
                "x": 0.726582,
                "y": 0.518253
              }
            ],
            "block_id": "p0_b000011",
            "reading_order": 11
          },
          {
            "text": "72.000",
            "confidence": 1.0,
            "polygon": [
              {
                "x": 0.89098,
                "y": 0.500289
              },
              {
                "x": 0.939178,
                "y": 0.500289
              },
              {
                "x": 0.939178,
                "y": 0.518229
              },
              {
                "x": 0.89098,
                "y": 0.518229
              }
            ],
            "block_id": "p0_b000012",
            "reading_order": 12
          },
          {
            "text": "2. Dich vu in tai lieu",
            "confidence": 1.0,
            "polygon": [
              {
                "x": 0.060406,
                "y": 0.557
              },
              {
                "x": 0.210361,
                "y": 0.557
              },
              {
                "x": 0.210361,
                "y": 0.57494
              },
              {
                "x": 0.060406,
                "y": 0.57494
              }
            ],
            "block_id": "p0_b000013",
            "reading_order": 13
          },
          {
            "text": "5",
            "confidence": 1.0,
            "polygon": [
              {
                "x": 0.621196,
                "y": 0.557319
              },
              {
                "x": 0.629029,
                "y": 0.557319
              },
              {
                "x": 0.629029,
                "y": 0.57494
              },
              {
                "x": 0.621196,
                "y": 0.57494
              }
            ],
            "block_id": "p0_b000014",
            "reading_order": 14
          },
          {
            "text": "12.000",
            "confidence": 1.0,
            "polygon": [
              {
                "x": 0.726582,
                "y": 0.557
              },
              {
                "x": 0.774178,
                "y": 0.557
              },
              {
                "x": 0.774178,
                "y": 0.57494
              },
              {